{
  "schema": "dna-personal-producer-profile",
  "version": "2.0",
  "identity": {
    "profileId": "profile-local-producer",
    "displayName": "Moj Premium producent",
    "locale": "hr-HR",
    "enabled": true,
    "localOnly": true,
    "createdDate": "2026-09-03",
    "updatedDate": "2026-09-03"
  },
  "source": {
    "workflowHashes": [
      "dd2c98395797c1ce5f08a6fe9f65d02c6f62de51b97bc50bda39024417eca911"
    ],
    "candidateSetHashes": [
      "3f77e080bf4a6016e23787b5e5777646cf7136826ffba3f222f3d9797b0f2b72"
    ],
    "learningEventHashes": [
      "51414e351ed80dfaff1184f369c5270a9ce6dad133036aa12870f1b32d9795b3",
      "8464026b2815deff218193d001001e5e03d2caf8466b8e563c89cb81edac3f14"
    ]
  },
  "learning": {
    "eventCount": 2,
    "acceptedVariantCount": 1,
    "manualLockCount": 1,
    "events": [
      {
        "eventId": "decision-accept-c-001",
        "eventType": "ACCEPT_VARIANT",
        "source": "USER_EXPLICIT",
        "accepted": true,
        "eventDate": "2026-09-03",
        "workflowHash": "dd2c98395797c1ce5f08a6fe9f65d02c6f62de51b97bc50bda39024417eca911",
        "candidateSetHash": "3f77e080bf4a6016e23787b5e5777646cf7136826ffba3f222f3d9797b0f2b72",
        "variantId": "C",
        "marker": null,
        "role": null,
        "patternId": null,
        "context": {
          "genre": "pop-folk",
          "density": "balanced",
          "transitions": "subtle",
          "syncopation": "medium",
          "space": "balanced"
        },
        "selections": [
          {
            "requestId": "i1cv1:drums",
            "marker": "i1cv1",
            "role": "drums",
            "patternId": "162.029.414",
            "sourceKind": "GOLD_PERFORMANCE",
            "density": 15.0,
            "register": {
              "low": 36,
              "high": 44
            },
            "candidateHash": "46db9eddfd7c2efb16ae0d9dc66de49917f539f1c926b6cdf2e992de116c2e49"
          },
          {
            "requestId": "i1cv1:bass",
            "marker": "i1cv1",
            "role": "bass",
            "patternId": "855.530.329",
            "sourceKind": "GOLD_PERFORMANCE",
            "density": 4.0,
            "register": {
              "low": 0,
              "high": 7
            },
            "candidateHash": "2ade3cd57f9c5dad09f30a38c2d875cf449ddcaf6dbee82ac4e980d1cb3141fa"
          },
          {
            "requestId": "i1cv1:guitar",
            "marker": "i1cv1",
            "role": "guitar",
            "patternId": "221.016.188",
            "sourceKind": "FACTORY_STRUMMING",
            "density": 12.0,
            "register": {
              "low": 0,
              "high": 17
            },
            "candidateHash": "d468606ae90367a1fa2618dc8f2ff6794b4b796f05b5a92db51bd7d56d014750"
          },
          {
            "requestId": "i1cv1:accompaniment",
            "marker": "i1cv1",
            "role": "accompaniment",
            "patternId": "433.730.033",
            "sourceKind": "GOLD_PERFORMANCE",
            "density": 8.0,
            "register": {
              "low": 0,
              "high": 2
            },
            "candidateHash": "6270ec828688fae1a587c2a5c3d4bb139d0a1ba9609292d3abdabe4386a79be8"
          },
          {
            "requestId": "i1cv1:pad",
            "marker": "i1cv1",
            "role": "pad",
            "patternId": "817.483.113",
            "sourceKind": "GOLD_PERFORMANCE",
            "density": 8.0,
            "register": {
              "low": 0,
              "high": 2
            },
            "candidateHash": "e7df516aa44b84a7e3dc2ad841f98ff8dbff16ce46480d5878e7918435f58925"
          },
          {
            "requestId": "i2cv1:drums",
            "marker": "i2cv1",
            "role": "drums",
            "patternId": "352.080.660",
            "sourceKind": "GOLD_PERFORMANCE",
            "density": 16.0,
            "register": {
              "low": 36,
              "high": 44
            },
            "candidateHash": "59d8aa03ff41b0181dd186c9fbe2168dff79758a6e2ab25456d7de344cea01c3"
          },
          {
            "requestId": "i2cv1:bass",
            "marker": "i2cv1",
            "role": "bass",
            "patternId": "325.888.314",
            "sourceKind": "GOLD_PERFORMANCE",
            "density": 4.0,
            "register": {
              "low": -5,
              "high": 0
            },
            "candidateHash": "3d1ea7f9a8d775c1f0304b941b3867104057cf2a627548a61b07b4016637453b"
          },
          {
            "requestId": "i2cv1:guitar",
            "marker": "i2cv1",
            "role": "guitar",
            "patternId": "939.356.320",
            "sourceKind": "FACTORY_STRUMMING",
            "density": 11.6,
            "register": {
              "low": 0,
              "high": 19
            },
            "candidateHash": "29a8cedfcc57549f0ea34bac7c4f9afa706fe1e79075cee17949b87bbe615d54"
          },
          {
            "requestId": "i2cv1:accompaniment",
            "marker": "i2cv1",
            "role": "accompaniment",
            "patternId": "710.244.816",
            "sourceKind": "GOLD_PERFORMANCE",
            "density": 8.0,
            "register": {
              "low": 0,
              "high": 2
            },
            "candidateHash": "ce8b0152469c01791abbe365e3ed38115dbeaedff152200224621956f3892ced"
          },
          {
            "requestId": "i2cv1:pad",
            "marker": "i2cv1",
            "role": "pad",
            "patternId": "389.122.481",
            "sourceKind": "GOLD_PERFORMANCE",
            "density": 8.0,
            "register": {
              "low": 0,
              "high": 2
            },
            "candidateHash": "0910e389cca366fd7c3b15da4fe5be0aaae28ac9549faac9e54c44bd25f61be0"
          },
          {
            "requestId": "v1cv1:drums",
            "marker": "v1cv1",
            "role": "drums",
            "patternId": "316.022.022",
            "sourceKind": "GOLD_PERFORMANCE",
            "density": 16.0,
            "register": {
              "low": 36,
              "high": 46
            },
            "candidateHash": "ec86906ea1ad12da7b7d76152b655c4e655607aaa9bb6271591388a230a9cdfc"
          },
          {
            "requestId": "v1cv1:bass",
            "marker": "v1cv1",
            "role": "bass",
            "patternId": "882.124.169",
            "sourceKind": "GOLD_PERFORMANCE",
            "density": 4.0,
            "register": {
              "low": -5,
              "high": 0
            },
            "candidateHash": "94a2f5f2f312eaa282afb942ad654b413a187b8e703af7495f22497b97fbdd65"
          },
          {
            "requestId": "v1cv1:guitar",
            "marker": "v1cv1",
            "role": "guitar",
            "patternId": "287.188.654",
            "sourceKind": "FACTORY_STRUMMING",
            "density": 9.5,
            "register": {
              "low": 0,
              "high": 16
            },
            "candidateHash": "a5ea69f55d4d3e25b6b4639830e9e5c066132d9459d04164581cfb4348315ce0"
          },
          {
            "requestId": "v1cv1:accompaniment",
            "marker": "v1cv1",
            "role": "accompaniment",
            "patternId": "640.216.299",
            "sourceKind": "GOLD_PERFORMANCE",
            "density": 8.0,
            "register": {
              "low": 0,
              "high": 2
            },
            "candidateHash": "6bfa9955be00f576719518cea77cc74a1c4486c236c3f809ad3deede3ce0a6b5"
          },
          {
            "requestId": "v1cv1:pad",
            "marker": "v1cv1",
            "role": "pad",
            "patternId": "092.805.847",
            "sourceKind": "GOLD_PERFORMANCE",
            "density": 16.0,
            "register": {
              "low": 0,
              "high": 0
            },
            "candidateHash": "a5b5a3f2717ebeb5b9a64cf44a5cb7345e48cb824e4767e36af4fbe6f806ca39"
          },
          {
            "requestId": "v2cv1:drums",
            "marker": "v2cv1",
            "role": "drums",
            "patternId": "080.792.087",
            "sourceKind": "GOLD_PERFORMANCE",
            "density": 16.0,
            "register": {
              "low": 36,
              "high": 44
            },
            "candidateHash": "ffdbbf406876a2f3a1c4d328a00419e7c518da607ffa449eda0e8b2a353e4f6f"
          },
          {
            "requestId": "v2cv1:bass",
            "marker": "v2cv1",
            "role": "bass",
            "patternId": "730.336.141",
            "sourceKind": "GOLD_PERFORMANCE",
            "density": 4.0,
            "register": {
              "low": 0,
              "high": 7
            },
            "candidateHash": "5981ddd7d1d37e7baeca0813db34594ebb07cfc3b9bf368b4724c8560f88e9dd"
          },
          {
            "requestId": "v2cv1:guitar",
            "marker": "v2cv1",
            "role": "guitar",
            "patternId": "459.412.112",
            "sourceKind": "FACTORY_STRUMMING",
            "density": 9.5,
            "register": {
              "low": 0,
              "high": 16
            },
            "candidateHash": "727311f9a2867e14de3d1a1e7cc49140d2501e63fcdd2116e3452000288f7a50"
          },
          {
            "requestId": "v2cv1:accompaniment",
            "marker": "v2cv1",
            "role": "accompaniment",
            "patternId": "587.243.106",
            "sourceKind": "GOLD_PERFORMANCE",
            "density": 8.0,
            "register": {
              "low": 0,
              "high": 2
            },
            "candidateHash": "6472f5ed6a71853cf42fbf4ef008cd51e582094a2758a4281087acd68519e1e6"
          },
          {
            "requestId": "v2cv1:pad",
            "marker": "v2cv1",
            "role": "pad",
            "patternId": "013.887.683",
            "sourceKind": "GOLD_PERFORMANCE",
            "density": 16.0,
            "register": {
              "low": 0,
              "high": 0
            },